{
    "description": "Model 1 ~ Simple model with linear terms",
    "id": 1,
    "linear_terms": [
        {
            "id": 2,
            "coeff": 1.3
        },
        {
            "id": 6,
            "coeff": -0.7
        }
    ],
    "metadata": {},
    "offset": 0.0,
    "quadratic_terms": [],
    "scale": 1.0,
    "variable_domain": "boolean",
    "variable_ids": [
        2,
        4,
        6
    ],
    "version": "1.0.0"
}