{
	"id": 2,
	"description": "Model 2 ~ Simple model with solutions",
	"linear_terms": [
		{
			"coeff": 1.3,
			"id": 1
		},
		{
			"coeff": -0.7,
			"id": 5
		}
	],
	"metadata": {},
	"offset": 1.23,
	"quadratic_terms": [
		{
			"coeff": -0.2,
			"id_head": 3,
			"id_tail": 1
		},
		{
			"coeff": 1.5,
			"id_head": 5,
			"id_tail": 1
		}
	],
	"scale": 2.7,
	"variable_domain": "spin",
	"variable_ids": [
		1,
		3,
		5
	],
	"version": "1.0.0",
	"solutions": [
		{
			"id": 0,
			"description": "first solution",
			"evaluation": 6.291,
			"assignment": [
				{
					"id": 1,
					"value": -1
				},
				{
					"id": 3,
					"value": 1
				},
				{
					"id": 5,
					"value": -1
				}
			]
		},
		{
			"id": 1,
			"description": "second solution",
			"evaluation": 9.531,
			"assignment": [
				{
					"id": 1,
					"value": 1
				},
				{
					"id": 3,
					"value": -1
				},
				{
					"id": 5,
					"value": 1
				}
			]
		}
	]
}