{
  "id": 3,
  "version": "1.0.0",
  "variable_domain": "spin",
  "variable_ids": [
    2,
    4,
    6
  ],
  "scale": 2.7,
  "offset": 1.23,
  "linear_terms": [
    {
      "coeff": 1.3,
      "id": 2
    },
    {
      "coeff": -0.7,
      "id": 6
    }
  ],
  "metadata": {
    "some_key_1": "any value",
    "some_key_2": 0.3,
    "some_key_3": null,
    "some_key_4": [
      "one",
      2,
      3.7,
      null
    ]
  },
  "quadratic_terms": [
    {
      "coeff": -0.2,
      "id_head": 4,
      "id_tail": 2
    },
    {
      "coeff": 1.5,
      "id_head": 6,
      "id_tail": 2
    }
  ],
  "description": "Model 3 ~ Simple model with quadratic terms and metadata"
}