{
	"id": 3,
	"version": "1.0.0",
	"variable_ids": [
		2,
		4,
		6
	],
	"variable_domain": "boolean",
	"scale": 2.7,
	"offset": 1.93,
	"linear_terms": [
		{
			"id": 2,
			"coeff": 0.0
		},
		{
			"id": 4,
			"coeff": 0.4
		},
		{
			"id": 6,
			"coeff": -4.4
		}
	],
	"quadratic_terms": [
		{
			"id_head": 2,
			"coeff": -0.8,
			"id_tail": 4
		},
		{
			"id_head": 2,
			"coeff": 6.0,
			"id_tail": 6
		}
	],
	"metadata": {
		"some_key_1": "any value",
		"some_key_2": 0.3,
		"some_key_3": null,
		"some_key_4": [
			"one",
			2,
			3.7,
			null
		]
	},
	"description": "Model 3 ~ Simple model with quadratic terms and metadata"
}